{
  "$schema": "../../../../schemas/api-profile-recipe.schema.json",
  "id": "openai-compatible.chat.cancellation",
  "profile": "openai-compatible",
  "schema_version": "openai-compatible/1",
  "operation": "chat.completions.create",
  "required_capabilities": [
    "api.level1",
    "api.chat.completions.create",
    "api.streaming",
    "api.cancellation"
  ],
  "status": "optional",
  "parameters": {
    "MODEL_ID": "example-model"
  },
  "request": {
    "body": {
      "model": "${MODEL_ID}",
      "messages": [
        {
          "role": "user",
          "content": "Start a long answer."
        }
      ],
      "stream": true
    },
    "nnrp": {
      "cancel_after_events": 1
    }
  },
  "expect": {
    "events": [
      {
        "type": "response.output_text.delta",
        "optional": true
      },
      {
        "type": "response.cancelled",
        "min_count": 1
      }
    ],
    "terminal": "cancelled"
  }
}
